Naam;URN;Waarde;IMBRO;IMBRO/A;Definitie
"KaderInwinning";"urn:bro:bhrgt:SurveyPurpose";"infrastructuurLand";"Ja";"Ja";"Onderzoek met als hoofddoel de geotechnische eigenschappen van de ondergrond te bepalen voor de aanleg en het onderhoud van wegen, spoorwegen, fiets- en voetpaden."
"KaderInwinning";"urn:bro:bhrgt:SurveyPurpose";"infrastructuurWater";"Ja";"Ja";"Onderzoek met als hoofddoel de geotechnische eigenschappen van de ondergrond te bepalen voor de aanleg en het onderhoud van waterwegen."
"KaderInwinning";"urn:bro:bhrgt:SurveyPurpose";"kabelsLeidingen";"Ja";"Ja";"Onderzoek met als hoofddoel de geotechnische eigenschappen van de ondergrond te bepalen voor de aanleg en het onderhoud van kabels en leidingen."
"KaderInwinning";"urn:bro:bhrgt:SurveyPurpose";"monitoring";"Ja";"Ja";"Onderzoek met als doel het beoordelen van veranderingen in de toestand van de ondergrond die het gevolg zijn van natuurlijke of door de mens in gang gezette processen of herhaaldelijk optredende gebeurtenissen; voorbeelden zijn bodemdaling, verdroging, trillingen en aardbevingen."
"KaderInwinning";"urn:bro:bhrgt:SurveyPurpose";"ontgronding";"Ja";"Ja";"Onderzoek ten behoeve van ontgrondingen (bijvoorbeeld zandwinning, grindwinning, baggeren)."
"KaderInwinning";"urn:bro:bhrgt:SurveyPurpose";"verkennendOnderzoek";"Ja";"Ja";"Verkennend geotechnisch onderzoek."
"KaderInwinning";"urn:bro:bhrgt:SurveyPurpose";"waterkering";"Ja";"Ja";"Onderzoek met als hoofddoel de geotechnische eigenschappen te bepalen voor de aanleg en het onderhoud alsmede beoordeling van dijken en dammen."
"KaderInwinning";"urn:bro:bhrgt:SurveyPurpose";"onbekend";"Nee";"Ja";"Het doel waarvoor het onderzoek is uitgevoerd is niet bekend."
"KaderstellendeProcedure";"urn:bro:bhrgt:SurveyProcedure";"EN1997d2v2007";"Ja";"Ja";"NEN-EN 1997-2:2007 Eurocode 7 Geotechnisch ontwerp. Deel 2: Grondonderzoek en beproeving inclusief nationale bijlage. De Eurocode 7 maakt deel uit van de eurocode serie van Europese standaarden (EN) gerelateerd aan constructies. In Eurocode 7 Geotechnisch ontwerp wordt omschreven hoe geotechnische constructies worden ontworpen. Eurocode 7 is op 12 juni 2006 goed gekeurd door het Europese Comité voor Standaardisatie en verplicht in de lidstaten vanaf maart 2010."
"KaderstellendeProcedure";"urn:bro:bhrgt:SurveyProcedure";"onbekend";"Nee";"Ja";"Het is niet bekend binnen welke procedurele kaders het booronderzoek is uitgevoerd. "
"Kalkgehalteklasse";"urn:bro:bhrgt:CarbonateContentClass";"kalkloos";"Ja";"Ja";"Geeft geen zichtbare of hoorbare opbruising bij het opdruppelen van verdund zoutzuur (10% HCl)."
"Kalkgehalteklasse";"urn:bro:bhrgt:CarbonateContentClass";"kalkhoudend";"Ja";"Ja";"Geeft alleen hoorbare opbruising bij het opdruppelen van verdund zoutzuur (10% HCl)."
"Kalkgehalteklasse";"urn:bro:bhrgt:CarbonateContentClass";"kalkrijk";"Ja";"Ja";"Geeft zowel zichtbare als hoorbare opbruising bij het opdruppelen van verdund zoutzuur (10% HCl)."
"Kleur";"urn:bro:bhrgt:Colour";"donkerblauw";"Ja";"Ja";"Donkerblauw omvat de Munsellkleuren 5P 4/2 (grayish purple), 5RP 4/2 (reddish purple), 5P 2/2 (very dusky purple) en 5RP 2/2 (very dusky reddish purple). Donkerblauw gebruikt onder NEN 5104 wordt niet gedefinieerd door de Munsellkleuren."
"Kleur";"urn:bro:bhrgt:Colour";"donkerbruin";"Ja";"Ja";"Donkerbruin omvat de Munsellkleuren 10YR 3/3, 7.5YR 3/2, 7.5YR 3/3, 7.5YR 3/4 (dark brown), 10YR 4/2, 2.5Y 4/2 (dark grayish brown), 2.5Y 3/3 (dark olive brown), 2.5YR, 2.5/3, 2.5YR 2.5/4, 2.5YR 3/3, 2.5YR 3/4, 5YR 2.5/2, 5YR 3/3 (dark reddish brown), 10YR 3/4, 10YR 3/6, 10YR 4/4, 10YR 4/6 (dark yellowish brown), 10YR 2/2, 7.5YR 2.5/2, 7.5YR 2.5/3 (very dark brown), 5YR 2/2 (dusky brown) en 10YR 3/2, 2.5Y 3/2 (very dark grayish brown). Donkerbruin gebruikt onder NEN 5104 wordt niet gedefinieerd door de Munsellkleuren."
"Kleur";"urn:bro:bhrgt:Colour";"donkergeel";"Ja";"Ja";"Donkergeel is gelijk aan de Munsellkleur 10Y 6/6 (dark greenish yellow) en 10YR 6/6, 10YR 6/8 (brownish yellow). Donkergeel gebruikt onder NEN 5104 wordt niet gedefinieerd door de Munsellkleuren."
"Kleur";"urn:bro:bhrgt:Colour";"donkergrijs";"Ja";"Ja";"Donkergrijs omvat de Munsellkleuren 10B 3/1, 10B 4/1, 5B 3/1, 5B 4/1, 5PB 3/1, 5PB 4/1 (dark bluish gray), 10YR 4/1, 2.5Y 4/1, 7.5YR 4/1, N 4/ (dark gray), , 10BG 4/1, 10G 4/1, 10GY 4/1, 10Y 4/1, 5BG 4/1, 5G 3/1, 5G 4/1, 5GY 4/1 (dark greenish gray), 10R 3/1, 10R 4/1, 2.5YR 3/1, 2.5YR 4/1, 5R 3/1, 5R 4/1, 5YR 4/2, 7.5R 3/1, 7.5R 4/1 (dark reddish gray) en 10YR 3/1, 2.5Y 3/1, 5Y 3/1, 5YR 3/1, 7.5YR 3/1, N 3/ (very dark gray)."
"Kleur";"urn:bro:bhrgt:Colour";"donkergroen";"Ja";"Ja";"Donkergroen omvat de Munsellkleuren 5G 2.5/2, 5G 3/2, 5GY 4/2 (dark grayish green), 5GY 3/2 (very dark grayisch green), 5GY 3/4 (dark olive green), 10BG 3/1, 10G 3/1, 10GY 3/1, 5BG 3/1 (very dark greenish gray), 5BG 3/2 (dusky blue green), 10GY 3/2 (dusky yellowish green) en 10GY 4/4 (dark yellowish green). Donkergroen gebruikt onder NEN 5104 wordt niet gedefinieerd door de Munsellkleuren."
"Kleur";"urn:bro:bhrgt:Colour";"donkerolijf";"Ja";"Ja";"Donkerolijf omvat de Munsellkleuren 10Y 3/4 (dark olive), 10Y 3/2 (very dark grayish olive) en 10Y 4/2 (dark grayish olive). Donkerolijf gebruikt onder NEN 5104 wordt niet gedefinieerd door de Munsellkleuren."
"Kleur";"urn:bro:bhrgt:Colour";"donkerrood";"Ja";"Ja";"Donkerrood omvat de Munsellkleuren 10R 3/6, 2.5YR 3/6, 5R 2.5/6, 5R 3/6, 5R 3/8, 7.5R 3/6, 7.5R 3/8 (dark red), 10R 2.5/2, 5R 2.5/2, 2.5YR 2.5/2, 5R 2.5/3, 5R 2.5/4, 7.5R 2.5/2, 7.5R 2.5/3, 7.5R 2.5/4, 10R 2/2 (very dusky red), 10R 3/2, 10R 3/3, 10R 3/4, 2.5YR 3/2, 5R 3/2, 5R 3/3, 5R 3/4, 7.5R 3/2, 7.5R 3/3, 7.5R 3/4 (dusky red), 5R 2/2 (blackish red) en 5R 2/6 (very dark red). Donkerrood gebruikt onder NEN 5104 wordt niet gedefinieerd door de Munsellkleuren."
"Kleur";"urn:bro:bhrgt:Colour";"lichtblauw";"Ja";"Ja";"Lichtblauw omvat de Munsellkleuren 5B 7/6 (light blue), 5B 6/2 (pale blue), 5P 6/2 (pale purple), 5PB 7/2 (pale blue) en 5B 8/2 (very pale blue). Lichtblauw gebruikt onder NEN 5104 wordt niet gedefinieerd door de Munsellkleuren."
"Kleur";"urn:bro:bhrgt:Colour";"lichtbruin";"Ja";"Ja";"Lichtbruin omvat de Munsellkleuren 7.5YR 6/3, 7.5YR 6/4, 5YR 5/6(light brown), 2.5Y 5/3, 2.5Y 5/4, 2.5Y 5/6, 2.5Y 5/8, 5Y 5/6 (light olive brown), 2.5YR 6/3, 2.5YR 6/4, 2.5YR 7/3, 2.5YR 7/4, 5YR 6/3, 5YR 6/4 (light reddish brown), 10YR 6/4, 2.5Y 6/3, 2.5Y 6/4 (light yellowish brown), 2.5Y 7/3, 2.5Y 7/4, 2.5Y 8/2, 2.5Y 8/3, 2.5Y 8/4, 10YR 6/3, 5YR 5/2 (pale brown), 10YR 6/2 (pale yellowish brown) en 10YR 7/3, 10YR 7/4, 10YR 8/2, 10YR 8/3, 10YR 8/4 10YR 8.5/2 (very pale brown). Lichtbruin gebruikt onder NEN 5104 wordt niet gedefinieerd door de Munsellkleuren."
"Kleur";"urn:bro:bhrgt:Colour";"lichtgeel";"Ja";"Ja";"Lichtgeel omvat de Munsellkleuren 10Y 8/2 (pale greenish yellow) en 5Y 7/3, 5Y 7/4, 5Y 8/2, 5Y 8/3, 2.5Y 8.5/2 (pale yellow), 2.5Y 9/2, 2.5Y 9.5/2 (very pale yellow) en 10YR 9/2, 10YR 9.5/2 (pale orange yellow). Lichtgeel gebruikt onder NEN 5104 wordt niet gedefinieerd door de Munsellkleuren."
"Kleur";"urn:bro:bhrgt:Colour";"lichtgrijs";"Ja";"Ja";"Lichtgrijs omvat de Munsellkleuren 10B 7/1, 10B 8/1, 5B 7/1, 5B 8/1, 5PB 7/1, 5PB 8/1 (light bluish gray), 2.5Y 6/2, 5YR 6/1 (light brownish gray), 10R 7/1, 10YR 7/1, 10YR 7/2, 2.5Y 7/1, 2.5Y 7/2, 5Y 7/1, 5YR 7/1, 7.5YR 7/1, N 7/(light gray) en 10BG 7/1, 10BG 8/1, 10G 7/1, 10G 8/1, 10GY 7/1, 10GY 8/1, 10Y 7/1, 10Y 8/1, 5BG 7/1, 5BG 8/1, 5G 7/1, 5G 8/1, 5GY 7/1, 5GY 8/1, 2.5YR 7/1 (light reddish gray), 5R 7/1, 5YR 6/2, 5YR 7/2, 7.5R 7/1, 7.5YR 6/2, 7.5YR 7/2 (pinkish gray) en 5Y 6/2, 5Y 5/2, 5Y 6/1 (light olive gray). Lichtgrijs gebruikt onder NEN 5104 wordt niet gedefinieerd door de Munsellkleuren."
"Kleur";"urn:bro:bhrgt:Colour";"lichtgroen";"Ja";"Ja";"Lichtgroen omvat de Munsellkleuren 5BG 6/6 (light bluish green), 5G 7/4 (light green), 5BG 7/2 (pale bluish green), 10G 6/2, 5G 6/2, 5G 7/2, 5G 8/2 (pale green), 5GY 6/4, 10GY 7/2 (pale yellowish green), 5GY 6/2 (light grayish green), 5GY 5/4 (light olive green), 5GY 7/2 (grayish yellow green) en 10G 8/2 (very pale green). Lichtgroen gebruikt onder NEN 5104 wordt niet gedefinieerd door de Munsellkleuren."
"Kleur";"urn:bro:bhrgt:Colour";"lichtolijf";"Ja";"Ja";"lichtolijf omvat de Munsellkleuren 10Y 5/4(light olive) en 10Y 6/2, 10Y 6/4, 5Y 6/3(pale olive). Lichtolijf gebruikt onder NEN 5104 wordt niet gedefinieerd door de Munsellkleuren."
"Kleur";"urn:bro:bhrgt:Colour";"lichtrood";"Ja";"Ja";"Lichtrood omvat de Munsellkleuren 7.5YR 9.5/2, 7.5YR 9/2 (pale yellowish pink), 5R 8/2, 5R 8/3, 5R 8/4, 7.5R 8/2, 7.5R 8/3, 7.5R 8/4 (light pink), 10R 6/6, 10R 6/8, 10R 7/6, 10R 7/8, 2.5YR 6/6, 2.5YR 6/8, 2.5YR 7/6, 2.5YR 7/8, 5R 6/6, 5R 6/8, 5R 7/6, 5R 7/8, 7.5R 6/6, 7.5R 6/8, 7.5R 7/6, 7.5R 7/8 (light red), 5RP 8/2 (pale pink), 10R 6/2, 10R 6/3, 10R 6/4, 10R 7/2, 10R 7/3, 2.5YR 6/2, 2.5YR 7/2, 5R 6/2, 5R 6/3, 5R 6/4, 5R 7/2, 5R 7/3, 5R 7/4, 7.5R 6/2, 7.5R 6/3, 7.5R 6/4, 7.5R 7/2, 7.5R 7/3, 7.5R 7/4 (pale red), 2.5YR 4/2, 2.5YR 5/2, 5R 4/2, 5R 4/3, 5R 4/4, 5R 5/2, 5R 5/3, 5R 5/4, 7.5R 4/2, 7.5R 4/3, 7.5R 4/4, 7.5R 5/2, 7.5R 5/3, 7.5R 5/4 (weak red). Lichtrood gebruikt onder NEN 5104 wordt niet gedefinieerd door de Munsellkleuren."
"Kleur";"urn:bro:bhrgt:Colour";"standaardBlauw";"Ja";"Ja";"Standaard blauw, tussen lichtblauw en donkerblauw, omvat de Munsellkleuren 5PB 3/2 (dusky blue), 5RP 6/2 (red purple), 5PB 5/2 (grayish blue), 5B 5/6 (medium blue)."
"Kleur";"urn:bro:bhrgt:Colour";"standaardBruin";"Ja";"Ja";"Standaard bruin, tussen lichtbruin en donkerbruin, omvat de Munsellkleuren 10YR 4/3, 10YR 5/3, 7.5YR 4/2, 7.5YR 4/3, 7.5YR 4/4, 7.5YR 5/2, 7.5YR 5/3, 7.5YR 5/4 (brown), 10YR 5/2, 2.5Y 5/2, 5YR 3/2, 5Y 8/4 (grayish brown), 2.5Y 4/3, 2.5Y 4/4, 2.5Y 4/6(olive brown), 5Y 4/4 (moderate olive brown), 2.5YR 4/3, 2.5YR 4/4, 2.5YR 5/3, 2.5YR 5/4, 5YR 4/3, 5YR 4/4, 5YR 5/3, 5YR 5/4 (reddish brown), 7.5YR 4/6, 7.5YR 5/6, 7.5YR 5/8 (strong brown), 5YR 3/4 (moderate brown), 10R 4/6 (moderate reddish brown) en 10YR 5/4, 10YR 5/6, 10YR 5/8 (yellowish brown). Standaardbruin wordt niet gebruikt onder NEN 5104."
"Kleur";"urn:bro:bhrgt:Colour";"standaardGeel";"Ja";"Ja";"Standaard geel, tussen lichtgeel en donkergeel, omvat de Munsellkleuren 10Y 7/4 (medium greenish yellow), 2.5Y 6/6, 2.5Y 6/8, 5Y 6/6, 5Y 6/8 (olive yellow), 5YR 6/6, 5YR 6/8, 5YR 7/6, 5YR 7/8, 7.5YR 6/6, 7.5YR 6/8, 7.5YR 7/6, 7.5YR 7/8, 7.5YR 8/6 (reddish yellow), 5Y 6/4 (dusky yellow) en 10YR 7/6, 10YR 7/8, 10YR 8/6, 10YR 8/8, 2.5Y 7/6, 2.5Y 7/8, 2.5Y 8/6, 2.5Y 8/8, 5Y 7/6, 5Y 7/8, 5Y 8/6, 5Y 8/8 (yellow). Standaardgeel wordt niet gebruikt onder NEN 5104."
"Kleur";"urn:bro:bhrgt:Colour";"standaardGrijs";"Ja";"Ja";"Standaard grijs, tussen lichtgrijs en donkergrijs, omvat de Munsellkleuren 10B 5/1, 10B 6/1, 5B 5/1, 5B 6/1, 5PB 5/1, 5PB 6/1 (bluish gray), 10YR 5/1, 10YR 6/1, 2.5Y 5/1, 2.5Y 6/1, 5Y 5/1, 5YR 5/1, 7.5YR 5/1, 7.5YR 6/1, N 5/, N 6/(gray), 10BG 5/1, 10BG 6/1, 10G 5/1, 10G 6/1, 10GY 5/1, 10GY 6/1, 10Y 5/1, 10Y 6/1, 5BG 5/1, 5BG 6/1, 5G 5/1, 5G 6/1, 5GY 5/1, 5GY 6/1 (greenish gray), 5YR 4/1 (brownish gray), 5Y 3/2, 5Y 4/2, 5Y 4/1 (olive gray), 5Y 7/2, 5Y 8/1 (yellowish gray)en 10R 5/1, 10R 6/1, 2.5YR 5/1, 2.5YR 6/1, 5R 5/1, 5R 6/1, 7.5R 5/1, 7.5R 6/1 (reddish gray). Standaardgrijs wordt niet gebruikt onder NEN 5104."
"Kleur";"urn:bro:bhrgt:Colour";"standaardGroen";"Ja";"Ja";"Standaard groen, tussen lichtgroen en donkergroen, omvat de Munsellkleuren 5BG 5/2 (bluish green), 5G 6/6 (brilliant green), , 5GY 5/2 (dusky yellowish green), 10G 4/2, 10GY 5/2, 5G 4/2, 5G 5/2 (grayish green), 5BG 4/6 (medium bluish green), 5G 5/6 (medium green), 5GY 4/4 (olive green) en 10GY 6/4, 5GY 7/4 (medium yellowish green). Standaardgroen wordt niet gebruikt onder NEN 5104."
"Kleur";"urn:bro:bhrgt:Colour";"standaardOlijf";"Ja";"Ja";"Standaard olijf, tussen lichtolijf en donkerolijf, omvat de Munsellkleuren 10Y 5/2 (grayish olive) en 5Y 4/35Y 5/3, 5Y 5/4, 10Y 4/4 (olive). Standaardolijf wordt niet gebruikt onder NEN 5104."
"Kleur";"urn:bro:bhrgt:Colour";"standaardRood";"Ja";"Ja";"Standaard rood, tussen lichtrood en donkerrood, omvat de Munsellkleuren 10R 4/8, 10R 5/6, 10R 5/8, 2.5YR 4/6, 2.5YR 4/8, 2.5YR 5/6, 2.5YR 5/8, 5R 4/6, 5R 4/8, 5R 5/6, 5R 5/8, 7.5R 4/6, 7.5R 4/8, 7.5R 5/6, 7.5R 5/8 (red), (very dusky red), 10R 8/3, 10R 8/4, 2.5YR 8/3, 2.5YR 8/4, 5YR 7/3, 5YR 7/4, 5YR 8/3, 7.5YR 7/3, 7.5YR 7/4, 7.5YR 8/3, 7.5YR 8/4 (pink), 10R 5/4, 10R 5/3, 10R 5/2, 10R 4/4, 10R 4/3, 10R 4/2 (weak red), 10R 7/4, 5YR 8/4 (moderate orange pink) en 5YR 4/6, 5YR 5/8 (yellowish red). Standaardrood wordt niet gebruikt onder NEN 5104."
"Kleur";"urn:bro:bhrgt:Colour";"wit";"Ja";"Ja";"Wit omvat de Munsellkleuren 5B 9/1 (bluish white), 10R 8/2, 2.5YR 8/2, 5YR 8/2, 7.5YR 8/2, 7.5YR 8.5/2 (pinkish white), 10R 8/1, 10YR 8/1, 2.5Y 8/1, 2.5YR 8/1, 5R 8/1, 5YR 8/1, 7.5R 8/1, 7.5YR 8/1, N 8/, N 9/, 10YR 8.5/1, 10YR 9.5/1, 10YR 9/1, 2.5Y 8.5/1, 2.5Y 9.5/1, 2.5Y 9/1, 7.5YR 8.5/1, 7.5YR 9.5/1, 7.5YR 9/1, N 8.5/ (white). Wit gebruikt onder NEN 5104 wordt niet gedefinieerd door de Munsellkleuren."
"Kleur";"urn:bro:bhrgt:Colour";"zwart";"Ja";"Ja";"Zwart omvat de Munsellkleuren 10YR 2/1, 2.5Y 2.5/1, 5Y 2.5/1, 5Y 2.5/2, 5YR 2.5/1, 7.5YR 2.5/1, N1, (black), 10B 2.5/1, 5B 2.5/1, 5PB 2.5/1 (bluish black), 5YR 2/1 (brownisch black), 10BG 2.5/1, 10G 2.5/1, 10GY 2.5/1, 10Y 2.5/1, 5BG 2.5/1, 5G 2.5/1, 5G 2/1, 5GY 2.5/1 5GY 2/1 (greenish black), 5Y 2/1 (olive black) 10R 2.5/1, 2.5YR 2.5/1, 5R 2.5/1, 7.5R 2.5/1 (reddish black), N2 (grayisch black), 10Y 3/1, 5GY 3/1 (very dark greenish gray). Zwart gebruikt onder NEN 5104 wordt niet gedefinieerd door de Munsellkleuren."
"Kleur";"urn:bro:bhrgt:Colour";"blauw";"Nee";"Ja";"Blauw zonder aanduiding van licht of donker zoals gebruikt onder NEN 5104."
"Kleur";"urn:bro:bhrgt:Colour";"bruin";"Nee";"Ja";"Bruin zonder aanduiding van licht of donker zoals gebruikt onder NEN 5104."
"Kleur";"urn:bro:bhrgt:Colour";"geel";"Nee";"Ja";"Geel zonder aanduiding van licht of donker zoals gebruikt onder NEN 5104."
"Kleur";"urn:bro:bhrgt:Colour";"groen";"Nee";"Ja";"Groen zonder aanduiding van licht of donker zoals gebruikt onder NEN 5104."
"Kleur";"urn:bro:bhrgt:Colour";"grijs";"Nee";"Ja";"Grijs zonder aanduiding van licht of donker zoals gebruikt onder NEN 5104."
"Kleur";"urn:bro:bhrgt:Colour";"olijf";"Nee";"Ja";"Olijf zonder aanduiding van licht of donker zoals gebruikt onder NEN 5104."
"Kleur";"urn:bro:bhrgt:Colour";"paars";"Nee";"Ja";"Paars zonder aanduiding van licht of donker zoals gebruikt onder NEN 5104."
"Kleur";"urn:bro:bhrgt:Colour";"rood";"Nee";"Ja";"Rood zonder aanduiding van licht of donker zoals gebruikt onder NEN 5104."
"LiggingOpGrondlichaam";"urn:bro:bhrgt:PositionOnGroundBody";"binnenteen";"Ja";"Ja";"De binnenteen is de overgang van het talud naar het maaiveld aan de binnenzijde (bij dijken de landzijde) van het grondlichaam."
"LiggingOpGrondlichaam";"urn:bro:bhrgt:PositionOnGroundBody";"buitenteen";"Ja";"Ja";"De buitenteen is de overgang van het talud naar het maaiveld aan de buitenzijde (bij dijken de waterzijde) van het grondlichaam."
"LiggingOpGrondlichaam";"urn:bro:bhrgt:PositionOnGroundBody";"kruin";"Ja";"Ja";"De top of het hoogste vlak van het grondlichaam."
"LiggingOpGrondlichaam";"urn:bro:bhrgt:PositionOnGroundBody";"talud";"Ja";"Ja";"De zijwand van het grondlichaam."
"LiggingOpGrondlichaam";"urn:bro:bhrgt:PositionOnGroundBody";"teen";"Ja";"Ja";"De overgang van het talud naar het maaiveld, niet nader gespecificeerd naar binnen- of buitenkant."
"LokaalVerticaalReferentiepunt";"urn:bro:bhrgt:LocalVerticalReferencePoint";"maaiveld";"Ja";"Ja";"Het oppervlak van de vaste aarde, daar waar de aarde niet bedekt is met water. Het maaiveld vormt de grens tussen de ondergrond en de bovengrond."
"LokaalVerticaalReferentiepunt";"urn:bro:bhrgt:LocalVerticalReferencePoint";"waterbodem";"Ja";"Ja";"De bodem van het waterlichaam. Deze vormt de grens tussen de ondergrond en de bovengrond, daar waar de aarde bedekt is met water."
"MatigGrofGrindGehalteklasse";"urn:bro:bhrgt:MediumCoarseGravelContentClass";"spoorTot1";"Nee";"Ja";"De fractie 5,6-16 mm maakt minder dan 1 procent van de massa van de grindfractie uit."
"MatigGrofGrindGehalteklasse";"urn:bro:bhrgt:MediumCoarseGravelContentClass";"weinig1tot25";"Nee";"Ja";"De fractie 5,6-16 mm maakt tussen 1 en 25 procent van de massa van de grindfractie uit."
"MatigGrofGrindGehalteklasse";"urn:bro:bhrgt:MediumCoarseGravelContentClass";"veel25tot50";"Nee";"Ja";"De fractie 5,6-16 mm maakt tussen 25 en 50 procent van de massa van de grindfractie uit."
"MatigGrofGrindGehalteklasse";"urn:bro:bhrgt:MediumCoarseGravelContentClass";"zeerVeel50tot75";"Nee";"Ja";"De fractie 5,6-16 mm maakt tussen 50 en 75 procent van de massa van de grindfractie uit."
"MatigGrofGrindGehalteklasse";"urn:bro:bhrgt:MediumCoarseGravelContentClass";"uiterstVeelMinstens75";"Nee";"Ja";"De fractie 5,6-16 mm maakt minstens 75 procent van de massa van de grindfractie uit."
"MethodeLocatiebepaling";"urn:bro:bhrgt:HorizontalPositioningMethod";"DGPS50tot200cm";"Ja";"Ja";"Meting d.m.v. Differential Global Positioning System, afwijking tussen 50 en 200 centimeter."
"MethodeLocatiebepaling";"urn:bro:bhrgt:HorizontalPositioningMethod";"GPS200tot1000cm";"Ja";"Ja";"Meting d.m.v. Global Positioning System, afwijking tussen 200 en 1000 centimeter."
"MethodeLocatiebepaling";"urn:bro:bhrgt:HorizontalPositioningMethod";"RTKGPS0tot2cm";"Ja";"Ja";"Meting d.m.v. Real Time Kinematic GPS, ook wel als DGPS aangeduid, afwijking kleiner dan 2 centimeter."
"MethodeLocatiebepaling";"urn:bro:bhrgt:HorizontalPositioningMethod";"RTKGPS2tot5cm";"Ja";"Ja";"Meting d.m.v. Real Time Kinematic GPS, ook wel als DGPS aangeduid, afwijking tussen 2 en 5 centimeter."
"MethodeLocatiebepaling";"urn:bro:bhrgt:HorizontalPositioningMethod";"RTKGPS5tot10cm";"Ja";"Ja";"Meting d.m.v. Real Time Kinematic GPS, ook wel als DGPS aangeduid, afwijking tussen 5 en 10 centimeter."
"MethodeLocatiebepaling";"urn:bro:bhrgt:HorizontalPositioningMethod";"RTKGPS10tot50cm";"Ja";"Ja";"Meting d.m.v. Real Time Kinematic GPS, ook wel als DGPS aangeduid, zonder fix, afwijking tussen 10 en 50 centimeter."
"MethodeLocatiebepaling";"urn:bro:bhrgt:HorizontalPositioningMethod";"tachymetrie0tot10cm";"Ja";"Ja";"Meting d.m.v. tachymetrie, ook wel als landmeting of Total Station aangeduid, vanaf een referentiepunt dat<i> </i>geen NAP-peilmerk is<i>,</i> afwijking kleiner dan 10 centimeter."
"MethodeLocatiebepaling";"urn:bro:bhrgt:HorizontalPositioningMethod";"tachymetrie10tot50cm";"Ja";"Ja";"Meting d.m.v. tachymetrie, ook wel als landmeting of Total Station aangeduid, vanaf een referentiepunt dat<i> </i>geen NAP-peilmerk is<i>, </i>afwijking tussen 10 en 50 centimeter."
"MethodeLocatiebepaling";"urn:bro:bhrgt:HorizontalPositioningMethod";"DGPS0tot100cm";"Nee";"Ja";"Meting d.m.v. Real Time Kinematic GPS, ook wel als DGPS aangeduid of d.m.v. Differential Global Positioning System, afwijking kleiner dan 100 centimeter."
"MethodeLocatiebepaling";"urn:bro:bhrgt:HorizontalPositioningMethod";"DGPS100tot500cm";"Nee";"Ja";"Meting d.m.v. Global Positioning System of d.m.v. Differential Global Positioning System, afwijking tussen 100 en 500 centimeter."
"MethodeLocatiebepaling";"urn:bro:bhrgt:HorizontalPositioningMethod";"GBKNonbekend";"Nee";"Ja";"Locatie bepaald aan de hand van de grootschalige basiskaart van Nederland (tegenwoordig BGT), afwijking onbekend."
"MethodeLocatiebepaling";"urn:bro:bhrgt:HorizontalPositioningMethod";"GPSonbekend";"Nee";"Ja";"Meting d.m.v. Global Positioning System, afwijking onbekend."
"MethodeLocatiebepaling";"urn:bro:bhrgt:HorizontalPositioningMethod";"kaartGrootschalig";"Nee";"Ja";"Locatie bepaald aan de hand van niet-digitale kaart, afwijking onbekend. Een grootschalige kaart is een kaart met een schaalgrootte niet kleiner dan 1:10.000 (bijvoorbeeld 1:500, 1:5.000 of 1:10.000)."
"MethodeLocatiebepaling";"urn:bro:bhrgt:HorizontalPositioningMethod";"kaartKleinschalig";"Nee";"Ja";"Locatie bepaald aan de hand van niet-digitale kaart, afwijking onbekend. Een kleinschalige kaart is een kaart met een schaalgrootte kleiner dan 1:10.000 (bijvoorbeeld 1:25.000, 1:50.000 of 1:100.000)."
"MethodeLocatiebepaling";"urn:bro:bhrgt:HorizontalPositioningMethod";"landmetingOnbekend";"Nee";"Ja";"Meting d.m.v. landmeting, afwijking onbekend."
"MethodeLocatiebepaling";"urn:bro:bhrgt:HorizontalPositioningMethod";"onbekend";"Nee";"Ja";"Het is niet bekend op welke manier de locatie is bepaald."
"MethodePositiebepalingSliblaag";"urn:bro:bhrgt:FluidMudLayerPositioningMethod";"akoestisch";"Ja";"Ja";"Via deze technieken wordt met een hoogfrequent (210 – 700 kHz) de afstand van een zender tot de bovenzijde van de sliblaag bepaald. Dit is de laag waarop het signaal reflecteert. Lage frequenties (15 – 30 kHZ) kunnen onder bepaalde omstandigheden gebruikt worden om de onderzijde van de sliblaag te definiëren."
"MethodePositiebepalingSliblaag";"urn:bro:bhrgt:FluidMudLayerPositioningMethod";"elektromagnetisch";"Ja";"Ja";"Bij deze techniek worden elektromagnetische pulsen gebruikt om de waterdiepte en onderzijde van de sliblaag te bepalen. Er wordt gewerkt met een zender en ontvanger. De resolutie is afhankelijk van de geleidbaarheid van het water, grondsoort, meetfrequentie. "
"MethodePositiebepalingSliblaag";"urn:bro:bhrgt:FluidMudLayerPositioningMethod";"radioactief";"Ja";"Ja";"Bij deze techniek wordt in de waterkolom de dichtheid radioactief bepaald. Op basis van dichtheidsverschillen wordt de top van de sliblaag vastgesteld."
"MethodePositiebepalingSliblaag";"urn:bro:bhrgt:FluidMudLayerPositioningMethod";"ultrasoon";"Ja";"Ja";"Bij deze techniek wordt in de waterkolom de dichtheid met hoogfrequente geluidsgolven bepaald. Op basis van dichtheidsverschillen wordt de top van de sliblaag vastgesteld."
"MethodePositiebepalingSliblaag";"urn:bro:bhrgt:FluidMudLayerPositioningMethod";"versnelling";"Ja";"Ja";"Bij deze techniek laat met een object in de waterkolom vallen. Door gelijktijdig de diepte en versnelling te meten kan worden afgeleid op welke diepte zich de bovenzijde van de sliblaag zich bevindt. In het slib zal de valversnelling van het instrument vertragen."
"MethodePositiebepalingSliblaag";"urn:bro:bhrgt:FluidMudLayerPositioningMethod";"visueel";"Ja";"Ja";"Voor metingen aan een monsterkolom wordt een transparante holle buis (aan de onderzijde al dan niet afsluitbaar) in de grond gedrukt. Visueel wordt dan de bovenzijde van de sliblaag bepaald."
"MethodePositiebepalingSliblaag";"urn:bro:bhrgt:FluidMudLayerPositioningMethod";"waterdruk";"Ja";"Ja";"Deze techniek maakt gebruik van een meetinstrument dat achter een boot voortgetrokken wordt. Hiervoor dient de dichtheid van de top van de sliblaag vooraf gedefinieerd te worden. Door het meetinstrument deze dichtheid te geven hoeft alleen de hoogte van de waterkolom boven het meetinstrument gemeten te worden met een waterdrukmeter."
"MethodePositiebepalingSliblaag";"urn:bro:bhrgt:FluidMudLayerPositioningMethod";"weerstandMechanisch";"Ja";"Ja";"Bij deze techniek wordt een meetlichaam mechanisch naar beneden gedrukt. De weerstanden hierbij worden geregistreerd. Dit kan tevens in de meetkop plaatsvinden zoals bij een sondering. "
"MethodePositiebepalingSliblaag";"urn:bro:bhrgt:FluidMudLayerPositioningMethod";"weerstandPeilhengel";"Ja";"Ja";"Bij toepassing van een peilhengel is een peilstok met een schijf van 10 cm diameter bevestigd aan een hengel. De hengel wordt gebruikt om de peilstok neer te laten tot deze blijft staan op een sliblaag. De diepte kan worden afgelezen (b-weerstand)."
"MethodePositiebepalingSliblaag";"urn:bro:bhrgt:FluidMudLayerPositioningMethod";"weerstandPeilstok";"Ja";"Ja";"Bij toepassing van een peilstok wordt gebruik gemaakt van een licht gewicht stok met een geperforeerde schijf van 10 tot 18 cm diameter om de bovenzijde van de sliblaag te bepalen op basis van gevoelde weerstand bij indrukken in de bodem (a-weerstand)."
"MethodeVerticalePositiebepaling";"urn:bro:bhrgt:VerticalPositioningMethod";"RTKGPS0tot4cm";"Ja";"Ja";"Meting d.m.v. Real Time Kinematic GPS, ook wel als DGPS aangeduid, afwijking kleiner dan 4 centimeter."
"MethodeVerticalePositiebepaling";"urn:bro:bhrgt:VerticalPositioningMethod";"RTKGPS4tot10cm";"Ja";"Ja";"Meting d.m.v. Real Time Kinematic GPS, ook wel als DGPS aangeduid, afwijking tussen 4 en 10 centimeter."
"MethodeVerticalePositiebepaling";"urn:bro:bhrgt:VerticalPositioningMethod";"RTKGPS10tot20cm";"Ja";"Ja";"Meting d.m.v. Real Time Kinematic GPS, ook wel als DGPS aangeduid, zonder fix, afwijking tussen 10 en 20 centimeter."
"MethodeVerticalePositiebepaling";"urn:bro:bhrgt:VerticalPositioningMethod";"RTKGPS20tot100cm";"Ja";"Ja";"Meting d.m.v. Real Time Kinematic GPS, ook wel als DGPS aangeduid, zonder fix, afwijking tussen 20 en 100 centimeter."
"MethodeVerticalePositiebepaling";"urn:bro:bhrgt:VerticalPositioningMethod";"tachymetrie0tot10cm";"Ja";"Ja";"Meting d.m.v. tachymetrie, ook wel als landmeting of Total Station aangeduid, vanaf een referentiepunt dat<i> </i>geen NAP-peilmerk is<i>, </i>afwijking kleiner dan 10 centimeter."
"MethodeVerticalePositiebepaling";"urn:bro:bhrgt:VerticalPositioningMethod";"tachymetrie10tot50cm";"Ja";"Ja";"Meting d.m.v. tachymetrie, ook wel als landmeting of Total Station aangeduid, vanaf een referentiepunt dat<i> </i>geen NAP-peilmerk is<i>, </i>afwijking tussen 10 en 50 centimeter."
"MethodeVerticalePositiebepaling";"urn:bro:bhrgt:VerticalPositioningMethod";"waterpassing0tot2cm";"Ja";"Ja";"Meting d.m.v. waterpassing vanaf een NAP-peilmerk, afwijking kleiner dan 2 centimeter<i>.</i>"
"MethodeVerticalePositiebepaling";"urn:bro:bhrgt:VerticalPositioningMethod";"waterpassing4tot10cm";"Ja";"Ja";"Meting d.m.v. waterpassing vanaf een NAP-peilmerk, afwijking tussen 2 en 4 centimeter."
"MethodeVerticalePositiebepaling";"urn:bro:bhrgt:VerticalPositioningMethod";"waterpassing2tot4cm";"Ja";"Ja";"Meting d.m.v. waterpassing vanaf een NAP-peilmerk, afwijking tussen 4 en 10 centimeter."
